<?xml version="1.0" encoding="UTF-8"?>
<stockReport xmlns="http://www.solms.co.za/retail/stockReport"
    xmlns:xsi="http://www.w3.org/2001/XMLSchema-instance"
    xsi:schemaLocation="http://www.solms.co.za/retail/stockReport 
    ./stockReport.xsd">
    <retailOutlets>

        <retailOutlet id="A!">
            <name>Albania Carpets</name>
            <address>12 Albany Rd, Tirana</address>
            <stockItems>
                <stockItem>
                    <product>C1</product>
                    <quantity>22</quantity>
                </stockItem>
                <stockItem>
                    <product>C2</product>
                    <quantity>6</quantity>
                </stockItem>
                <stockItem>
                    <product>C3</product>
                    <quantity>41</quantity>
                </stockItem>
            </stockItems>
        </retailOutlet>
        
        <retailOutlet id="A2">
            <name>Damascus Carpets</name>
            <address>12 Damsa Rd, Damascus</address>
            <stockItems>
                <stockItem>
                    <product>C1</product>
                    <quantity>92</quantity>
                </stockItem>
                <stockItem>
                    <product>C2</product>
                    <quantity>56</quantity>
                </stockItem>
            </stockItems>
        </retailOutlet>
        
    </retailOutlets>
    
    <products>
        <product code="C1">
            <name>Royal Blue</name>
            <price>2345.67</price>
        </product>
        
        <product code="C2">
            <name>Tranquil Green</name>
            <price>7654.32</price>
        </product>
        
        <product code="C3">
            <name>Might Black</name>
            <price>2367.45</price>
        </product>
    </products>
</stockReport>
